<?xml version = "1.0"?>

<!-- Simple W3C XML Schema document -->
<schema xmlns = "http://www.w3.org/2001/XMLSchema"    
   xmlns:deitel = "http://www.deitel.com/studenti"    
   targetNamespace = "http://www.deitel.com/studenti">

   <element name = "studenti" type = "deitel:StudentiType"/>

   <complexType name = "StudentiType">
      <sequence>
         <element name = "student" type = "deitel:StudentType"
            minOccurs = "1" maxOccurs = "unbounded"/>         
      </sequence>
   </complexType>

   <complexType name = "StudentType">
      <all>
         <element name = "ime" type = "string"/>
		 <element name = "priimek" type = "string"/>
		 <element name = "projekt" type = "string" minOccurs="0" maxOccurs="1"/>
      </all>
	  <attribute name="vpisna" type="string" use="required"/>
   </complexType>
</schema>

